{
  "$schema": "../../../source/wildlands/source/schemas/game.schema.json",
  "format": "wildlands-game",
  "schemaVersion": 1,
  "id": "littlewild",
  "name": "Littlewild",
  "version": "1.0.0",
  "template": "colony",
  "engine": {
    "api": 1
  },
  "features": [
    "storytelling-player"
  ],
  "content": {
    "balancing": "content/balancing.json",
    "assets": "assets",
    "creatures": {
      "catalog": "assets/creatures/catalog.json",
      "editorFields": "assets/creatures/editor-fields.json"
    },
    "interactions": "assets/interactions/catalog.json",
    "packs": [
      "content/littlewild.pack.json"
    ],
    "defaultId": "littlewild",
    "canonicalId": "littlewild",
    "skillTree": "content/skill-tree.json",
    "adventureExamples": [
      "content/adventure-example.json"
    ]
  },
  "presentation": {
    "title": "Littlewild",
    "description": "A little life. A shared adventure. Littlewild is an offline, autonomous-buddy RPG prototype.",
    "accent": "#355a4a"
  },
  "storage": {
    "namespace": "littlewild"
  },
  "targets": {
    "html": {
      "output": "demos/littlewild.html",
      "budgetBytes": 4194304
    },
    "godot": {
      "engineSources": false
    }
  }
}
